ComentarioCrudo,ComentarioLimpio
"Ke injusticia tan grande de arriba,porke toda una vida x delante","Ke injusticia tan grande de arriba,porke toda una vida x delante"
Dios proteja a esa familia y les de el consuelo necesario para llevar adelante sta pena,Dios proteja a esa familia y les de el consuelo necesario para llevar adelante sta pena
Mucha fuerza a la mamá ke perdió a sus hijos y a su esposa para criar a sus hijitos tan pequeños.,Mucha fuerza a la mamá ke perdió a sus hijos y a su esposa para criar a sus hijitos tan pequeños.
"Que tristeza
de verdad que triste","Que tristeza
de verdad que triste"
Que triste,Que triste
Que pena de familia!,Que pena de familia!
"algo no cuadra, hay que investigar","algo no cuadra, hay que investigar"
La gente que le da me divierte ? Todo bien en casa en la vida ?,La gente que le da me divierte ? Todo bien en casa en la vida ?
"Tanto HP Malo que hay en este MUNDO y que hacen daño a la humanidad y siempre Mueren los Buenos, soy muy creyente pero DIOS no considero esto justo.","Tanto HP Malo que hay en este MUNDO y que hacen daño a la humanidad y siempre Mueren los Buenos, soy muy creyente pero DIOS no considero esto justo."
¡¡¡Muy triste!!! Q.E.P.D.descansen los hermanos,¡¡¡Muy triste!!! Q.E.P.D.descansen los hermanos
DEP,DEP
QEPD,QEPD
Una verdadera pena descanse en paz,Una verdadera pena descanse en paz
La muerte forma parte de la vida. No hay que olvidar eso. Hay que vivir todos los días sabiendo que un día podés morir.,La muerte forma parte de la vida. No hay que olvidar eso. Hay que vivir todos los días sabiendo que un día podés morir.
"Este tema de los autos caros y la velocidad los enceguese, una pena","Este tema de los autos caros y la velocidad los enceguese, una pena"
Estas cosas le pasa a todo el mundo,Estas cosas le pasa a todo el mundo
Que tristeza.,Que tristeza.
La vida se está llevando a todos los buenos y los malos siguen en la tierra haciendo daño no entiendo nada,La vida se está llevando a todos los buenos y los malos siguen en la tierra haciendo daño no entiendo nada
Que pena dios,Que pena dios
"Que noticia más desagradable q tragedia para esa familia y para el mundo del fútbol
EPD","Que noticia más desagradable q tragedia para esa familia y para el mundo del fútbol
EPD"
Q noticia más triste como la vida se puede apagar en un instante,Q noticia más triste como la vida se puede apagar en un instante
Descanse en paz. Mi más sentido pésame a la familia,Descanse en paz. Mi más sentido pésame a la familia
Quectremenda noticia mi Dios **,Quectremenda noticia mi Dios
"Pobre familia, padres, esposa e hijitos...","Pobre familia, padres, esposa e hijitos..."
Dios mio dales el consuelo que su corazón tanto necesita con esta pérdida tan grande para ellos!,Dios mio dales el consuelo que su corazón tanto necesita con esta pérdida tan grande para ellos!
Que noticia más triste,Que noticia más triste
"Mis condolencias a toda su familia, QEPD Diogo un abrazo hasta el cielo.","Mis condolencias a toda su familia, QEPD Diogo un abrazo hasta el cielo."
Paz a tu alma,Paz a tu alma
Dios le de mucha fortaleza y consuelo a tos su familia. Lo sentimos mucho,Dios le de mucha fortaleza y consuelo a tos su familia. Lo sentimos mucho
"Se nos fue un grande, Diogo ( Q.E.P D.), la selección de los elegidos por Dios, te espera en el cielo,","Se nos fue un grande, Diogo Q.E.P D., la selección de los elegidos por Dios, te espera en el cielo,"
Que tristeza Dios.Gran verdad hoy estamos mañana.no sabemos la vida es tan corta.,Que tristeza Dios.Gran verdad hoy estamos mañana.no sabemos la vida es tan corta.
Q.E.P.D. y Q.D.D.G....,Q.E.P.D. y Q.D.D.G....
"Eran dos, hermanos! Que tristeza para esos padres","Eran dos, hermanos! Que tristeza para esos padres"
Una lastima una perdida irreparable,Una lastima una perdida irreparable
DEP,DEP
Uff que fuerte. Tan joven y buen jugador. Q.e.p.d. sin palabras,Uff que fuerte. Tan joven y buen jugador. Q.e.p.d. sin palabras
q triste noticia.. q injusta la vida.. QEPD,q triste noticia.. q injusta la vida.. QEPD
La vidad tedad y te quitad,La vidad tedad y te quitad
Todos les duele la partida de el porque el era futbolista famoso pero el hermano que ? Desafortunadamente una mamá perdió a dos hijos al mismo tiempo DESCANSEN EN PAZ,Todos les duele la partida de el porque el era futbolista famoso pero el hermano que ? Desafortunadamente una mamá perdió a dos hijos al mismo tiempo DESCANSEN EN PAZ
Un fuerte abrazo,Un fuerte abrazo
"RIP Jota
I can't hold my tears","RIP Jota
I cant hold my tears"
Y que hacía ese jugador en la calle a las doce y pico de la noche en vez de estar en su casa con sus hijos y mujer?? DEP,Y que hacía ese jugador en la calle a las doce y pico de la noche en vez de estar en su casa con sus hijos y mujer?? DEP
La vida es verdaderamente injusta,La vida es verdaderamente injusta
Paz en su tumba,Paz en su tumba
Pero que le paso,Pero que le paso
Que triste,Que triste
"Q triste realidad,si existe un Dios pq no frena estás cosas","Q triste realidad,si existe un Dios pq no frena estás cosas"
EPD,EPD
"Que triste noticia saber que eran tan felices con tantas cosas en su vida , y de un momento a otro en un abrir y cerrar de ojos dejaste a una familia sufriendo por tu partida ,Dios te proteja por haber hecho hasta donde te lo permitió ser un buen padre , esposo y persona ,vuela alto y descansa en paz , valoremos el día a día","Que triste noticia saber que eran tan felices con tantas cosas en su vida , y de un momento a otro en un abrir y cerrar de ojos dejaste a una familia sufriendo por tu partida ,Dios te proteja por haber hecho hasta donde te lo permitió ser un buen padre , esposo y persona ,vuela alto y descansa en paz , valoremos el día a día"
No es justo...,No es justo...
QEPD,QEPD
Madre mía que pena,Madre mía que pena
Que terrible!!!,Que terrible!!!
Que lamentable un excelente jugador; Dios le conceda fortaleza a su espos e hijos.,Que lamentable un excelente jugador; Dios le conceda fortaleza a su espos e hijos.
Así es la vida. En la vida todos estamos de paso.,Así es la vida. En la vida todos estamos de paso.
"Que tristeza
descansa en paz junto a tu hermano","Que tristeza
descansa en paz junto a tu hermano"
"Muy triste noticia, sobretodo para su familia.","Muy triste noticia, sobretodo para su familia."
"Unos padres perdieron a sus hijos, una esposa perdió a su esposo, unos niños perdieron a su padre y a su tío, uno no sabe cuando podrá ser la última mañana que verá el sol o disfrutar de una última bebida.","Unos padres perdieron a sus hijos, una esposa perdió a su esposo, unos niños perdieron a su padre y a su tío, uno no sabe cuando podrá ser la última mañana que verá el sol o disfrutar de una última bebida."
Qepd,Qepd
"Y bueno para la muerte no existe edad,ni que profesión tenes,,ni quien sos,cuando te llega la hora te llega,a el ,le llego","Y bueno para la muerte no existe edad,ni que profesión tenes,,ni quien sos,cuando te llega la hora te llega,a el ,le llego"
"Que pena, que triste,D.E.P","Que pena, que triste,D.E.P"
"Que Dios lo tenga en la gloria, y el fútbol y nosotros le hecharemos de menos en las canchas","Que Dios lo tenga en la gloria, y el fútbol y nosotros le hecharemos de menos en las canchas"
Descansa en paz.,Descansa en paz.
Qdep amén,Qdep amén
Descansa en paz,Descansa en paz
"Lo triste es que deja tres chiquitines, a una familia sin esposo, padre e hijo y a un club en el que me gustaba como jugaba YNWA Diogo","Lo triste es que deja tres chiquitines, a una familia sin esposo, padre e hijo y a un club en el que me gustaba como jugaba YNWA Diogo"
En la biblia dice que ay personas que se van antes pues que son muy buenas personas y pues dios no quiere ver a sus ciervos este mundo por eso les quita la vida tempranamente para que vivan en el reino de dios yo sé que Diego jota está feliz arriba que descanse en paz Diego jota,En la biblia dice que ay personas que se van antes pues que son muy buenas personas y pues dios no quiere ver a sus ciervos este mundo por eso les quita la vida tempranamente para que vivan en el reino de dios yo sé que Diego jota está feliz arriba que descanse en paz Diego jota
Que Dios y la virgen consuela a su familia QEPD.,Que Dios y la virgen consuela a su familia QEPD.
"Yo me vengo despertando
y veo esto me di cuenta por Georgina digo yo como
que es esto. Pero no solamente fue Jota, también entiendo que su hermano.","Yo me vengo despertando
y veo esto me di cuenta por Georgina digo yo como
que es esto. Pero no solamente fue Jota, también entiendo que su hermano."
"RIP
what a sad
news DEP","RIP
what a sad
news DEP"
Q.E.P.D.,Q.E.P.D.
QEPD. Que Dios y nuestra madre consuele ala familia amigos .,QEPD. Que Dios y nuestra madre consuele ala familia amigos .
Misericordia papi Dios de tus hijos,Misericordia papi Dios de tus hijos
QEPD,QEPD
"Que lamentable paz a sus restos, mucha fortaleza a toda su familia.","Que lamentable paz a sus restos, mucha fortaleza a toda su familia."
"Que triste, lamentable noticia, Dios sea dando consuelo!!","Que triste, lamentable noticia, Dios sea dando consuelo!!"
Adiós Diogo,Adiós Diogo
"Dios le de el descanso eterno y a su flia mucha fortaleza,es muy triste todo esto","Dios le de el descanso eterno y a su flia mucha fortaleza,es muy triste todo esto"
QEPD un gran jugador,QEPD un gran jugador
Seguro fue por exceso de velocidad,Seguro fue por exceso de velocidad
Que tristeza que ingunsta es la vida,Que tristeza que ingunsta es la vida
"Que dolor tan grandes, descansa en paz Diogo y hermano , fortaleza a su familia","Que dolor tan grandes, descansa en paz Diogo y hermano , fortaleza a su familia"
Dios que triste el fútbol te llora maestro dios te tenga en su gloria,Dios que triste el fútbol te llora maestro dios te tenga en su gloria
Cómo así,Cómo así
Porque tiene que pasar ésas cosas,Porque tiene que pasar ésas cosas
"Todos los fanáticos del fútbol estamos en shock
. Vuelen alto tu hermano y tú","Todos los fanáticos del fútbol estamos en shock
. Vuelen alto tu hermano y tú"
Una trajedia,Una trajedia
D.E.P. erasy serás siempre un crack,D.E.P. erasy serás siempre un crack
Mis condolencia ala familia,Mis condolencia ala familia
Huy cómo así que le pasó que gran jugador era vengo despertando y veo está noticia,Huy cómo así que le pasó que gran jugador era vengo despertando y veo está noticia
Se casó cómo Dios manda i la muerte lo separó cómo dios manda también,Se casó cómo Dios manda i la muerte lo separó cómo dios manda también
No puedo con tanto,No puedo con tanto
La.vida es fragil...un dia estamos ..y al otro no sabemos....,La.vida es fragil...un dia estamos ..y al otro no sabemos....
Sin palabras,Sin palabras
Váyanse a la vrg tan joven pudfffd,Váyanse a la vrg tan joven pudfffd
Cuando toca toca y dios sabe porque,Cuando toca toca y dios sabe porque
Que pena.Dios le dé la gloria eterna,Que pena.Dios le dé la gloria eterna
Que la pena de haberlo perdido: no nos quite la alegria de haberlo tenido. Fuerza familiares y amigos siempre.,Que la pena de haberlo perdido no nos quite la alegria de haberlo tenido. Fuerza familiares y amigos siempre.
Los caminos del señor son imprescindibles.,Los caminos del señor son imprescindibles.
"Que duro, paz a sus restos y fortaleza a su familia","Que duro, paz a sus restos y fortaleza a su familia"
"X favor Dios ,dale consuelo a esta familia","X favor Dios ,dale consuelo a esta familia"
Que triste pérdida Q.E.P.D,Que triste pérdida Q.E.P.D
QUE DIOS LE DE FORTALEZA A LA MAMA.....QUE SUS 2 HIJOS VUELEN ALTO.....,QUE DIOS LE DE FORTALEZA A LA MAMA.....QUE SUS 2 HIJOS VUELEN ALTO.....
.,.
k pena,k pena
Qué fuerte!,Qué fuerte!
Mucha fuerza para esa esposa y para esos padres q están destrozados mucho ánimo,Mucha fuerza para esa esposa y para esos padres q están destrozados mucho ánimo
"Bueno veamos el lado positivos hay algunos que e van de este mundo sin tener un solo hijos en la completa miseria, eso es la vida","Bueno veamos el lado positivos hay algunos que e van de este mundo sin tener un solo hijos en la completa miseria, eso es la vida"
La vida teda sorpresas,La vida teda sorpresas
Que pena,Que pena
Dios lo acoja en su reino,Dios lo acoja en su reino
"No es muy comun en el futbol .joder yo recuerdo que al jugar incluso decia ,la tiene ""diogo shotaa"".triste para toda nuestra comunidad futbol","No es muy comun en el futbol .joder yo recuerdo que al jugar incluso decia ,la tiene diogo shotaa.triste para toda nuestra comunidad futbol"
Que triste que pasen cosas como estas esta de luto el fútbol y el mundo entero que ama este lindo deporte fuerza a sus familiares,Que triste que pasen cosas como estas esta de luto el fútbol y el mundo entero que ama este lindo deporte fuerza a sus familiares
EPD,EPD
"Que triste. noticia, sus hijitos tan lindos, su esposa.","Que triste. noticia, sus hijitos tan lindos, su esposa."
Dios les de mucha fortaleza y resignación.,Dios les de mucha fortaleza y resignación.
Que Dios lo tenga en su santa Gloria,Que Dios lo tenga en su santa Gloria
Que ha pasado??,Que ha pasado??
Por que la vida a veces es tan injusta,Por que la vida a veces es tan injusta
"Los momentos más lindos duran poco, la verdadera felicidad, valoren infinitamente aquellos momentos que se les presente en esta jodida vida...","Los momentos más lindos duran poco, la verdadera felicidad, valoren infinitamente aquellos momentos que se les presente en esta jodida vida..."
Che ¿te imaginás el dolor tan grande de sus familiares y en especial su esposa?,Che ¿te imaginás el dolor tan grande de sus familiares y en especial su esposa?
Que pena,Que pena
Descansa em paz,Descansa em paz
"D.E.P , muy injusta esta vida","D.E.P , muy injusta esta vida"
Caprichosa no la inmadurez de una persona sabiendo que tienen una carrera y familia por delante,Caprichosa no la inmadurez de una persona sabiendo que tienen una carrera y familia por delante
Yo deberás no comprendo por qué pasan estas cosas? No entiendo...,Yo deberás no comprendo por qué pasan estas cosas? No entiendo...
Normal. Lo bueno dura poco asi que cuando sientas que eres feliz disfrutalo porque va acabar,Normal. Lo bueno dura poco asi que cuando sientas que eres feliz disfrutalo porque va acabar
Fortaleza para su esposa y no sabemos cuando ni a que hora sera nuestro ultimo paso descanse en paz,Fortaleza para su esposa y no sabemos cuando ni a que hora sera nuestro ultimo paso descanse en paz
D.E.P. amen,D.E.P. amen
Por eso disfrutemos lo que nos da la vida ; aprovechemos el tiempo y solo… amemos!,Por eso disfrutemos lo que nos da la vida ; aprovechemos el tiempo y solo amemos!
"Muy lamentable y triste,así es la vida, al ser humano nos han enseñado a prepararnos para vivir y tenerlo todo para este mundo,Pero muchas veces dejamos a un lado lo espiritual e ignoramos que en la vida Dios lo es todo tengas fama dinero o no, porque al final todos tenemos que morir pero las personas aveces olvidan que no somos eternos y que de una u otra forma partiremos de este mundo y hay que prepararse para eso, para el dolor inesperado porque en ese momento no hay nada terrenal que te consuele y ese dolor solo lo calma Dios en nuestros corazones","Muy lamentable y triste,así es la vida, al ser humano nos han enseñado a prepararnos para vivir y tenerlo todo para este mundo,Pero muchas veces dejamos a un lado lo espiritual e ignoramos que en la vida Dios lo es todo tengas fama dinero o no, porque al final todos tenemos que morir pero las personas aveces olvidan que no somos eternos y que de una u otra forma partiremos de este mundo y hay que prepararse para eso, para el dolor inesperado porque en ese momento no hay nada terrenal que te consuele y ese dolor solo lo calma Dios en nuestros corazones"
A una familia q pierde a 2 de sus hijos .,A una familia q pierde a 2 de sus hijos .
Cumplió muy bien su misión hacer felices a los suyos y su gran afición.,Cumplió muy bien su misión hacer felices a los suyos y su gran afición.
"La vida es así hoy estamos mañana quién sabe, que triste no lo puedo creer que DIOS le dé muchas fuerzas a sus familiares","La vida es así hoy estamos mañana quién sabe, que triste no lo puedo creer que DIOS le dé muchas fuerzas a sus familiares"
QEPD,QEPD
No me puedo imaginar el dolor de la familia pero espero esto sea una lección q hay q conducir con precaución y no con alta velocidad para que evitar este tipo de trajedia q lamentaremos por el resto de nuestras vidas,No me puedo imaginar el dolor de la familia pero espero esto sea una lección q hay q conducir con precaución y no con alta velocidad para que evitar este tipo de trajedia q lamentaremos por el resto de nuestras vidas
Que dios los reciba en su santa gloria y descansen en la paz del señor,Que dios los reciba en su santa gloria y descansen en la paz del señor
Qepd....muy triste noticia. Fuerzas a la familia.,Qepd....muy triste noticia. Fuerzas a la familia.
Que Dios os bendiga a los cinco.,Que Dios os bendiga a los cinco.
"Que triste que QEPD Diogo Jota, fuerza a la familia, los acompaño en su dolor.","Que triste que QEPD Diogo Jota, fuerza a la familia, los acompaño en su dolor."
Por andar corriendo como loco.,Por andar corriendo como loco.
Amen,Amen
Que triste tan joven.,Que triste tan joven.
"Mis condolencias para sus papás ,esposa sus niños que triste va a ser su vida doy en adelante mucho ánimo que Dios los ilumine y los proteja siempre Amén","Mis condolencias para sus papás ,esposa sus niños que triste va a ser su vida doy en adelante mucho ánimo que Dios los ilumine y los proteja siempre Amén"
Qie desgracia dios,Qie desgracia dios
EPD,EPD
"No dicen nombre ni en qué equipo jugaba, ni de que país. Es como falsa noticia. Hunmmm","No dicen nombre ni en qué equipo jugaba, ni de que país. Es como falsa noticia. Hunmmm"
Dios mio padre amado fortaleza para toda su familia y guardanos apadre cubrenos con tu sangre poderosa que tiene poder en todo momento Dios. Mio,Dios mio padre amado fortaleza para toda su familia y guardanos apadre cubrenos con tu sangre poderosa que tiene poder en todo momento Dios. Mio
"Dios lo tenga en la gloria, nosotros lo amantes del futbol estamos tristes, perdimos a un gran jugador y una buena persona","Dios lo tenga en la gloria, nosotros lo amantes del futbol estamos tristes, perdimos a un gran jugador y una buena persona"
Que tristeza siento en mi corazón descansa en paz Diego Jota nunca te olvidaremos te vas dejando el nombres de tu país en lo más alto,Que tristeza siento en mi corazón descansa en paz Diego Jota nunca te olvidaremos te vas dejando el nombres de tu país en lo más alto
QEPD,QEPD
Que injusta es la vida a veces...,Que injusta es la vida a veces...
Que Pena! Muchísimo ánimo a la familia.,Que Pena! Muchísimo ánimo a la familia.
D.E.P.,D.E.P.
"Que triste encontrarse con esta noticia, resignación cristiana a su familia","Que triste encontrarse con esta noticia, resignación cristiana a su familia"
M..Fortaleza,M..Fortaleza
Que pena...aun no me lo creo que triste,Que pena...aun no me lo creo que triste
Asuuu que tristeza,Asuuu que tristeza
Pronta resignación a toda la familia,Pronta resignación a toda la familia
Condolencias a la familia,Condolencias a la familia
QEPD mis condolencias a su familia,QEPD mis condolencias a su familia
Muy triste. Una familia tan bonita,Muy triste. Una familia tan bonita
Que pena,Que pena
Fortaleza para su familia,Fortaleza para su familia
"Q dolor tan grande para los padres de estos dos muchachos,sobran las palabras en este momento tan triste,yo soy muy aficionada al fooboll y solo dijo q en verdad me invade la tristeza,Dios permita mucha resignación a toda su familia y q Dios nuestro señor tenga en su santo reino a estos muchachos","Q dolor tan grande para los padres de estos dos muchachos,sobran las palabras en este momento tan triste,yo soy muy aficionada al fooboll y solo dijo q en verdad me invade la tristeza,Dios permita mucha resignación a toda su familia y q Dios nuestro señor tenga en su santo reino a estos muchachos"
No me lo creo,No me lo creo
"Dios mío!!!!
Mucha fortaleza a su familia que en paz Descansen.","Dios mío!!!!
Mucha fortaleza a su familia que en paz Descansen."
Y tres chicos omg,Y tres chicos omg
"Oh Dios santo, la vida es un ratito
Q.D.E.P fortaleza a su familia","Oh Dios santo, la vida es un ratito
Q.D.E.P fortaleza a su familia"
queeee,queeee
Que descanse en paz y brille para él la luz que no tiene fin . Y que Dios dé consuelo a su familia y la proteja siempre .,Que descanse en paz y brille para él la luz que no tiene fin . Y que Dios dé consuelo a su familia y la proteja siempre .
"Que desgracia se fue un gran jugador, condole ncias a su familia.","Que desgracia se fue un gran jugador, condole ncias a su familia."
"La mayoría de las notas solo hablan de él, Diogo y su HERMANO!!!","La mayoría de las notas solo hablan de él, Diogo y su HERMANO!!!"
Tremendo jugador te vamos a estrañar descanza es paz,Tremendo jugador te vamos a estrañar descanza es paz
Cuando los humos se suben a la cabeza y se creen inmortales.,Cuando los humos se suben a la cabeza y se creen inmortales.
Pero que paso o que?,Pero que paso o que?
"Que injusta es la vida con los mas buenos
...","Que injusta es la vida con los mas buenos
..."
MHSRIP,MHSRIP
DOLOR..MAS DOLOR...FUERZA A TODA LA FAMILIA,DOLOR..MAS DOLOR...FUERZA A TODA LA FAMILIA
EPD,EPD
Que le sucedió,Que le sucedió
DESCASE EN PAZ,DESCASE EN PAZ
Solo Dios sabe nuestro destino D.E.P,Solo Dios sabe nuestro destino D.E.P
"La Gambeta
ahora es la vida... Y no la responsabilidad de uno mismo... Que tal eh... Ahora los accidentes los causa la Vida por qué es caprichosa ... Interesante","La Gambeta
ahora es la vida... Y no la responsabilidad de uno mismo... Que tal eh... Ahora los accidentes los causa la Vida por qué es caprichosa ... Interesante"
Que tristeza,Que tristeza
que triste Dios solo vos tenés esa respuesta x que señor milagroso x que la vida hace esto x que,que triste Dios solo vos tenés esa respuesta x que señor milagroso x que la vida hace esto x que
Muy triste,Muy triste
Tristeza infinita....que diosito lo tenga a su lado x dios fuerza a su fia,Tristeza infinita....que diosito lo tenga a su lado x dios fuerza a su fia
Rest In Heaven,Rest In Heaven
"Hermosa familia!, que Dios le dé consuelo a su esposa y sus hijos.","Hermosa familia!, que Dios le dé consuelo a su esposa y sus hijos."
"Diogo se que tú famas seva quedar inolvidable en este mundo, demostraste todos tus jerarquía como futbolista le isiste vibrar a tu sere queridos/as, que descanse en paz amigo. Amén","Diogo se que tú famas seva quedar inolvidable en este mundo, demostraste todos tus jerarquía como futbolista le isiste vibrar a tu sere queridosas, que descanse en paz amigo. Amén"
Por eso dice Dios en su palabra Veníd luego y estemos a cuentas. De qué le sirve al hombre ganar el mundo y perder su alma. No sabemos el día ni la ora. Por eso tenemos que buscar a Dios de corazón y alejarse del pecado antes que sea demaciado tarde,Por eso dice Dios en su palabra Veníd luego y estemos a cuentas. De qué le sirve al hombre ganar el mundo y perder su alma. No sabemos el día ni la ora. Por eso tenemos que buscar a Dios de corazón y alejarse del pecado antes que sea demaciado tarde
En gloria esté,En gloria esté
"EPD
crack","EPD
crack"
Mis condolencias .,Mis condolencias .
Que en paz descanse,Que en paz descanse
Hasta pronto Diogo y Andre,Hasta pronto Diogo y Andre
Dios le de mucha fortaleza en estos momentos a su familia. Descansa en Paz,Dios le de mucha fortaleza en estos momentos a su familia. Descansa en Paz
"Tener que sepultar a dos de tus hijos el mismo día debe ser lo más difícil de todo, sus padres deben estar devastados","Tener que sepultar a dos de tus hijos el mismo día debe ser lo más difícil de todo, sus padres deben estar devastados"
Que horror,Que horror
Que le pasó?,Que le pasó?
Que tristeza más grande para una familia Dios les de la fuerza por el dolor de la partida de estos jóvenes que Dios le reciba en su santo reino Q E P D,Que tristeza más grande para una familia Dios les de la fuerza por el dolor de la partida de estos jóvenes que Dios le reciba en su santo reino Q E P D
QEPD.,QEPD.
Que tristeza,Que tristeza
Pobre niños se quedan sin padre,Pobre niños se quedan sin padre
"Diosssss miooooo que tristeza que dolor tan grande para sus padres, esposa e hijos
y amigos verdaderos
muy triste
desde Venezuela
mucha fortaleza, resignación y mucha paz QEPD chicos..la perdida de dos hijos
en realidad de ningún hijo
No está nada fácil mucha terapia mi Dios ayuda a su familia con ese inmenso dolor
es muy fuerte","Diosssss miooooo que tristeza que dolor tan grande para sus padres, esposa e hijos
y amigos verdaderos
muy triste
desde Venezuela
mucha fortaleza, resignación y mucha paz QEPD chicos..la perdida de dos hijos
en realidad de ningún hijo
No está nada fácil mucha terapia mi Dios ayuda a su familia con ese inmenso dolor
es muy fuerte"
"Mucha fuerza a la familia, Q. E. P. D","Mucha fuerza a la familia, Q. E. P. D"
Por irresponsable esa. Es la vverdad,Por irresponsable esa. Es la vverdad
Que tristeza sin palabras,Que tristeza sin palabras
Triste noticia,Triste noticia
Descanse en paz bendiciones para toda su familia,Descanse en paz bendiciones para toda su familia
Padre celestial...q terrible noticia... Vuela alto crack y que Diosito le de consuelo a tú familia Estoy en shock y muy triste..yo que soy un aficionado ya me imagino el dolor tan grande de tu familia....,Padre celestial...q terrible noticia... Vuela alto crack y que Diosito le de consuelo a tú familia Estoy en shock y muy triste..yo que soy un aficionado ya me imagino el dolor tan grande de tu familia....
DEP,DEP
